"url","repo","title","downloads","description","authors","date","role"
"https://cran.r-project.org/package=MplusAutomation","CRAN","MplusAutomation",135434,"Automate latent variable model estimation and interpretation using 'Mplus'.","Hallquist, M., Wiley, J., Van Lissa, C. J.",2019,"Contributor"
"https://cran.r-project.org/package=tidyLPA","CRAN","tidyLPA",43032,"Easily Carry Out Latent Profile Analysis.","Rosenberg, J. M., Van Lissa, C. J., Schmidt, J. A., Beymer, P. N., Anderson, D.",2018,"Lead developer"
"https://cran.r-project.org/package=bain","CRAN","bain",36317,"Test Bayesian informative hypotheses for frequentist analyses.","Gu, X., Hoijtink, H., Mulder, J., Van Lissa, C. J.",2018,"Lead developer"
"https://cran.r-project.org/package=BFpack","CRAN","BFpack",28636,"Implementation of various default Bayes factors for testing statistical hypotheses.","Mulder, J., Van Lissa, C. J., et al.",2019,"Lead developer"
"https://cran.r-project.org/package=metaforest","CRAN","metaforest",21291,"Conduct random forests-based meta-analysis.","Van Lissa, C. J.",2017,"Lead developer"
"https://cran.r-project.org/package=tidySEM","CRAN","tidySEM",17159,"Tidy workflow for running, tabulating, and graphing structural equation models","Van Lissa, C. J.",2020,"Lead developer"
"https://cran.r-project.org/package=gorica","CRAN","gorica",10145,"Test informative hypotheses using the generalized order restricted information criterion.","Van Lissa, C. J., Altinisik, Y., Kuiper, R. M.",2019,"Lead developer"
"https://cran.r-project.org/package=worcs","CRAN","worcs",9170,"Workflow for Open Reproducible Code in Science","Van Lissa, C. J., Brandmaier, A. M., & Peikert, A.",2020,"Lead developer"
"https://cran.r-project.org/package=pema","CRAN","pema",782,"Select relevant moderators using Bayesian regularized meta-regression.","Van Lissa, C. J., & van Erp, S.",2021,"Lead developer"
